{
  "schema_version": "0.1.1",
  "graph_id": "fixture_charref_not_in_ontology",
  "entry_node_id": "start",
  "scene_anchor": "scene_waystation_of_iron_oath",
  "character_refs": ["char_vellin", "char_unknown_specter"],
  "nodes": {
    "start": {
      "node_id": "start",
      "type": "dialogue",
      "narration": "A declared character is not in the ontology.",
      "speaker_ref": "char_vellin",
      "location_ref": "scene_waystation_of_iron_oath",
      "on_enter_effects": [],
      "options": [
        {
          "option_id": "opt_go",
          "text": "Leave.",
          "target_node_id": "end",
          "condition": null,
          "effects": [],
          "unavailable_behavior": "hide"
        }
      ]
    },
    "end": {
      "node_id": "end",
      "type": "end",
      "narration": "Fin.",
      "speaker_ref": null,
      "location_ref": "scene_waystation_of_iron_oath",
      "options": []
    }
  }
}
